,conversation,reference,score
diagnoses_confirmed,,,0.0
diagnoses_suspected,"Bilateral lower limb ischemia
 Massive aortic thromboembolism
 Aortic dissection (high risk)
 Renal artery occlusion or dissection (high risk)
 Kidney failure (high risk)",,0.0
treatment_plan,"Immediate anticoagulation with heparin
 Emergent endovascular intervention (thrombectomy or stenting)
 Aggressive pain management and supportive care
 Catheter-based thrombolysis with tPA
 Angioplasty and stenting in the aorta and/or iliac arteries
 IV fluids and monitoring for kidney function
 Consider renal protective measures","Emergency bilateral lower limb angioplasty
 Athrombectomy
 Balloon angioplasty
 Catheter-directed thrombolysis (CDT) of the aortic thrombus with a bolus dose of 5 mg
 Infusion with tissue plasminogen activator (0.5 mg/hour)
 Systemic intravenous infusion of unfractionated heparin at 500 IU/hour
 Oral antiplatelet therapy of aspirin and clopidogrel
 Oral anticoagulant therapy with 5 mg warfarin daily",0.5052539261643906
risks,"High risk of limb loss due to bilateral lower limb ischemia
 High risk of mortality due to massive aortic thromboembolism
 Potential complications: stroke, myocardial infarction, renal failure",Deterioration of kidney function secondary to infarction,0.49080746047933277
next_steps,"Continuous monitoring of vital signs, blood pressure, and neurological status
 Regular imaging to assess aortic dissection progression
 Consult with cardiothoracic surgery and vascular surgery teams
 Consult with nephrology for renal management","Monitoring in the intensive care unit (ICU) by a multidisciplinary team
 Stage II pharmaco-mechanical thrombolysis in the catheterization lab
 Close follow-up of kidney function by the nephrology team",0.5295146329498838
notes,Time is of the essence for interventions to minimize complications,"An abdominal angiogram showed patency of the distal aorta and iliac vessels, confirming successful recanalization after CDT.
 Creatinine increased to 409 umol/L but improved with intravenous hydration.
 The patient was downgraded to the regular surgical floor after one week.",0.20374000462214775
